{
  "schema": "e7q.ir.graph/v0alpha1",
  "name": "bounded UTF-8 identity",
  "artifacts": [
    {
      "schema": "e7q.ir.artifact/v0alpha1",
      "kind": "source",
      "profile": {
        "id": "e7q.ir.circuit-basic",
        "version": "0alpha1",
        "capabilities_required": []
      },
      "provenance": {
        "created_at": "2026-09-06T00:00:00Z",
        "actor": "unspecified",
        "source_refs": []
      },
      "payload": {
        "format": "openqasm-2",
        "content": "OPENQASM 2.0;\ninclude \"qelib1.inc\";\nqreg q[1];\ncreg c[1];\nh q[0];\nmeasure q[0] -> c[0];\n",
        "byte_length": 88,
        "content_digest": "sha256:d8b1ddfdd7ef3f53f221fe5c6849a59e82a633a871a0cf5d439a8b72d9b24ffa"
      },
      "limitations": [],
      "artifact_id": "sha256:d9a5178678aca937e01e8ce8b8e9b39bd6194492380abbef4bfc174fd0b8127e"
    },
    {
      "schema": "e7q.ir.artifact/v0alpha1",
      "kind": "representation",
      "profile": {
        "id": "e7q.ir.circuit-basic",
        "version": "0alpha1",
        "capabilities_required": []
      },
      "provenance": {
        "created_at": "2026-09-06T00:00:00Z",
        "actor": "unspecified",
        "source_refs": []
      },
      "payload": {
        "format": "openqasm-2",
        "content": "OPENQASM 2.0;\ninclude \"qelib1.inc\";\nqreg q[1];\ncreg c[1];\nh q[0];\nmeasure q[0] -> c[0];\n",
        "byte_length": 88,
        "content_digest": "sha256:d8b1ddfdd7ef3f53f221fe5c6849a59e82a633a871a0cf5d439a8b72d9b24ffa"
      },
      "limitations": [],
      "artifact_id": "sha256:bfb697e8b3d8a7bf7088b1e28cfd4d06fdec7b623e3de511ce7c362bc90cb675"
    }
  ],
  "relations": [
    {
      "kind": "transforms",
      "source": "sha256:d9a5178678aca937e01e8ce8b8e9b39bd6194492380abbef4bfc174fd0b8127e",
      "target": "sha256:bfb697e8b3d8a7bf7088b1e28cfd4d06fdec7b623e3de511ce7c362bc90cb675",
      "validation_status": "validated",
      "criterion": {
        "id": "e7q.ir.utf8-byte-identity",
        "version": "1"
      },
      "preserves": [
        "utf8-bytes"
      ],
      "loses": [],
      "assumptions": [],
      "relation_id": "sha256:2d0892dae869321badb82719f3230a1198073737ed21f85f293efe5031731826"
    }
  ],
  "graph_id": "sha256:6db6b4e587e905d87320fb884606fd5fc5393f53165462737d20cb64a0c2922d"
}
