{
  "schema": "e7q.ir.graph/v0alpha1",
  "name": "Original H/u2 acceptance pair",
  "artifacts": [
    {
      "schema": "e7q.ir.artifact/v0alpha1",
      "kind": "source",
      "profile": {
        "id": "e7q.ir.circuit-basic",
        "version": "0alpha1",
        "capabilities_required": []
      },
      "provenance": {
        "created_at": "2026-09-06T00:00:00Z",
        "actor": "unspecified",
        "source_refs": []
      },
      "payload": {
        "format": "openqasm-2",
        "content": "OPENQASM 2.0;\ninclude \"qelib1.inc\";\nqreg q[2];\ncreg c[2];\nh q[0];\ncx q[0],q[1];\nmeasure q -> c;\n",
        "byte_length": 96,
        "content_digest": "sha256:2fb143875ed170f0535a9227c3f6bece9ac82278de05a5a9513aec75dc9ada33"
      },
      "limitations": [],
      "artifact_id": "sha256:253a134e1db41053a41df98045f876381fc338529c1c3017b14327ffb3d16d3d"
    },
    {
      "schema": "e7q.ir.artifact/v0alpha1",
      "kind": "representation",
      "profile": {
        "id": "e7q.ir.circuit-basic",
        "version": "0alpha1",
        "capabilities_required": []
      },
      "provenance": {
        "created_at": "2026-09-06T00:00:00Z",
        "actor": "unspecified",
        "source_refs": []
      },
      "payload": {
        "format": "openqasm-2",
        "content": "OPENQASM 2.0;\ninclude \"qelib1.inc\";\nqreg q[2];\ncreg c[2];\nu2(0,pi) q[0];\ncx q[0],q[1];\nmeasure q -> c;\n",
        "byte_length": 103,
        "content_digest": "sha256:2ecb97226585c4c6145ac9dd54673e5e6c0c5349bf256db513e157a2039926e1"
      },
      "limitations": [],
      "artifact_id": "sha256:1406a0026557461e26d302c5fc89e02b01eca2e341673e4f48c63777a1da8050"
    }
  ],
  "relations": [
    {
      "kind": "transforms",
      "source": "sha256:253a134e1db41053a41df98045f876381fc338529c1c3017b14327ffb3d16d3d",
      "target": "sha256:1406a0026557461e26d302c5fc89e02b01eca2e341673e4f48c63777a1da8050",
      "validation_status": "validated",
      "criterion": {
        "id": "e7q.ir.real-h-unitary",
        "version": "1"
      },
      "preserves": [
        "unitary-prefix",
        "terminal-measurement-map"
      ],
      "loses": [
        "source-spelling-and-gate-decomposition"
      ],
      "assumptions": [
        "real-h-gate-table-v1"
      ],
      "relation_id": "sha256:8a8e2722c79d8027b1b5972743e3de876c864ad2b7bea44c8fafdc8d06e6bdfe"
    }
  ],
  "graph_id": "sha256:96b2d5e81410b9053c6ef0d0c27e366c8718a6398f295a314948edd69c32ffc4"
}
